{
  "schema_version": 1,
  "type": "jasefly-module",
  "name": "SDK Boundary Probe",
  "slug": "sdk-boundary-probe",
  "version": "1.0.0",
  "description": "Architectural synthetic module — proves unknown ZIP slug works without core edits. No product features.",
  "author": {
    "name": "Jasefly",
    "url": "https://jasefly.com"
  },
  "license": "MIT",
  "jasefly": {
    "min_version": "1.0.0",
    "api_version": 1,
    "sdk_version": 1
  },
  "php": {
    "min_version": "8.1",
    "extensions": ["json"]
  },
  "dependencies": {
    "required": {
      "system": ">=1.0.0"
    },
    "optional": {},
    "conflicts": {}
  },
  "capabilities": {
    "requires": [
      "api.routes",
      "admin.pages",
      "permissions.check",
      "events.publish",
      "events.subscribe",
      "builder.widgets"
    ],
    "provides": [
      "sdk-boundary-probe.ping"
    ]
  },
  "entrypoints": {
    "backend": "backend/SdkBoundaryProbeModule.php",
    "frontend_manifest": "frontend-dist/manifest.json"
  },
  "migrations": {
    "path": "migrations",
    "namespace": "sdk-boundary-probe",
    "uninstall_path": "migrations/uninstall"
  },
  "permissions": [
    "sdk-boundary-probe.view"
  ],
  "install": {
    "preserve_data_on_uninstall": true,
    "allow_downgrade": false
  },
  "hooks": {
    "after_install": "hooks/PostInstallHook.php"
  }
}
